{
  "schema_version": 1,
  "verified_at": "2026-08-13T00:00:00Z",
  "valid_until": "2026-09-13T00:00:00Z",
  "actions": {
    "actions/checkout": {
      "version": "v6.0.2",
      "sha": "de0fac2e4500dabe0009e67214ff5f5447ce83dd",
      "runtime": "node24",
      "minimum_runner": "2.329.0",
      "source_url": "https://github.com/actions/checkout/releases/tag/v6.0.2"
    },
    "actions/setup-python": {
      "version": "v6.2.0",
      "sha": "a309ff8b426b58ec0e2a45f0f869d46889d02405",
      "runtime": "node24",
      "minimum_runner": "2.327.1",
      "source_url": "https://github.com/actions/setup-python/releases/tag/v6.2.0"
    }
  }
}
